{
  "command": ["codex", "setup", "--dry-run", "--format", "text"],
  "expected_contains": [
    "WinChronicle Codex setup dry-run",
    "Fast path for Codex App:",
    "1. Add local plugin source:",
    "2. In a Codex App thread, say:",
    "- 开始记录工作",
    "- 查看工作记录状态",
    "- 停止工作并总结",
    "3. Keep summaries local unless you explicitly ask Codex to paste them into chat.",
    "Safety boundary:",
    "dry run only: yes",
    "writes Codex config: no",
    "writes WinChronicle state: no",
    "starts capture now: no",
    "reads desktop: no",
    "Observed content trust: untrusted_observed_content",
    "no screenshots, OCR, clipboard, desktop control, or MCP write tools",
    "Summary boundary:",
    "record-only summary uses summary-level evidence",
    "does not send raw observed text",
    "not a telemetry or log-counter report",
    "Technical counters belong only in the explicit technical/debugging view",
    "For diagnostics: winchronicle doctor",
    "For JSON setup details: winchronicle codex setup --dry-run",
    "For plugin-only path: winchronicle codex plugin --dry-run --format text"
  ],
  "forbidden_substrings": [
    "dry run only: no",
    "writes Codex config: yes",
    "writes WinChronicle state: yes",
    "starts capture now: yes",
    "reads desktop: yes",
    "\"command\":",
    "visible_text",
    "focused_text",
    "password",
    "Local checks:",
    "Read-only MCP tools:",
    "Next commands:",
    "Disabled surfaces remain off:",
    "desktop-observation",
    "raw JSON"
  ],
  "ordered_pairs": [
    ["WinChronicle Codex setup dry-run", "Fast path for Codex App:"],
    ["Fast path for Codex App:", "Safety boundary:"],
    ["Safety boundary:", "Summary boundary:"],
    ["Summary boundary:", "For diagnostics:"],
    ["For diagnostics:", "For JSON setup details:"],
    ["For JSON setup details:", "For plugin-only path:"]
  ]
}
