{
  "command": ["codex", "daily", "--dry-run", "--format", "text"],
  "expected_contains": [
    "WinChronicle Codex daily dry-run",
    "Dry run only: yes",
    "Writes config: no",
    "Writes state: no",
    "Starts capture: no",
    "Reads desktop: no",
    "Adds MCP tools: no",
    "Observed content trust: untrusted_observed_content",
    "Add local plugin source:",
    "First prompt to try: 开始记录工作",
    "What to say next:",
    "- 开始记录工作",
    "- 查看工作记录状态",
    "- 停止工作并总结",
    "Disabled surfaces remain off:",
    "- screenshots",
    "- ocr",
    "- clipboard",
    "- desktop_control",
    "- mcp_write_tools",
    "Summary boundary:",
    "record-only summary uses summary-level evidence",
    "does not send raw observed text",
    "not a telemetry or log-counter report",
    "Technical counters belong only in the explicit technical/debugging view",
    "Record-only boundary:",
    "Do not inspect, scan, review, edit, test, commit, push, or release repository files.",
    "do not run repository preflight commands such as git status",
    "Record-only thread prompt:",
    "Only call WinChronicle workday commands for this thread.",
    "winchronicle workday intent \"开始工作\" --execute",
    "winchronicle workday intent \"结束工作并总结\" --execute --wait-seconds 60",
    "winchronicle workday intent \"查看工作记录状态\" --execute",
    "Only paste a summary into chat after the user explicitly asks for chat output.",
    "No new capture, upload, control, or MCP write surfaces are added."
  ],
  "forbidden_substrings": [
    "Dry run only: no",
    "Writes config: yes",
    "Writes state: yes",
    "Starts capture: yes",
    "Reads desktop: yes",
    "Adds MCP tools: yes",
    "\"command\":",
    "visible_text",
    "focused_text",
    "password",
    "desktop-observation",
    "raw JSON"
  ],
  "ordered_pairs": [
    ["WinChronicle Codex daily dry-run", "Add local plugin source:"],
    ["Add local plugin source:", "What to say next:"],
    ["What to say next:", "Disabled surfaces remain off:"],
    ["Disabled surfaces remain off:", "Summary boundary:"],
    ["Summary boundary:", "Record-only boundary:"],
    ["Record-only boundary:", "Record-only thread prompt:"],
    ["Record-only thread prompt:", "No new capture, upload, control, or MCP write surfaces are added."]
  ]
}
